<?xml version="1.0" encoding="utf-8"?>
<xs:schema id="ArrayOfTranslation" xmlns="" xmlns:xs="http://www.w3.org/2001/XMLSchema" xmlns:msdata="urn:schemas-microsoft-com:xml-msdata">
  <xs:element name="ArrayOfTranslation" msdata:IsDataSet="true" msdata:UseCurrentLocale="true">
    <xs:complexType>
      <xs:sequence minOccurs="0" maxOccurs="unbounded">
        <xs:element name="Translation">
          <xs:complexType>
            <xs:sequence>
              <xs:element name="Old" type="xs:string" minOccurs="0" />
              <xs:element name="New" type="xs:string" minOccurs="0" />
            </xs:sequence>
          </xs:complexType>
        </xs:element>
      </xs:sequence>
    </xs:complexType>
  </xs:element>
</xs:schema>