<?xml version="1.0" encoding="utf-8" ?>
<ArrayOfTranslation xmlns:xsi="http://www.w3.org/2001/XMLSchema-instance" xmlns:xsd="http://www.w3.org/2001/XMLSchema" xsi:noNamespaceSchemaLocation="Translations.xsd">
  <Translation>
    <!--
    &#xA; is the escape sequence for newline characters.
    Old text must be an exact character-for-character match. Find strings with a decompiler or disassembler.
    The new text should not be longer than the old; any extra characters are ignored (UTF-16 encoded).
    -->
    <Old>&#xA;Press E to configure</Old>
    <New>&#xA;Don't press E.</New>
  </Translation>
  <Translation>
    <Old>&#xA;(Home) Raise Lift.</Old>
    <New>&#xA;(Home) Go Higher.</New>
  </Translation>
  <Translation>
    <Old>&#xA;Keeps charge when picked up&#xA;Press 'Shift+E' to light fuse</Old>
    <New>&#xA;Keeps charge when broken&#xA;Press 'Shift+E' to SUPER-charge!</New>
  </Translation>
</ArrayOfTranslation>